{
  "schema_version": "v0.1",
  "candidate_id": "carry_2026_04_17_001",
  "turn_id": "turn_2026_04_17_002",
  "source_note_id": "note_2026_04_17_002",
  "source_scope": "project",
  "decision": "carry-forward",
  "candidate_type": "external-pattern",
  "candidate_text": "Reference mature companion projects for a boundary matrix, minimal directory layout, and the Prelude/Postlude seam.",
  "rationale": "This is reusable external project guidance that can shape future host integrations without implying any personal memory system.",
  "evidence": [
    "Reference mature companion projects for a boundary matrix, minimal directory layout, and the Prelude/Postlude seam.",
    "Treat finalize-turn as the stable seam for end-of-turn host integration."
  ],
  "confidence": "high",
  "stability": "durable",
  "write_target": "carry-forward"
}
